{
  "receipt_id": "deploy-135c168d1308",
  "from_version": "0.1.0-beta.12",
  "to_version": "0.1.0-rc.1",
  "patch": "atlas-framework-0.1.0-rc.1-incremental.zip",
  "applied_at": "2026-07-31T02:06:16.447308+00:00",
  "files_added": [
    "release/RC-1-MIGRATION.md",
    "release/RC-1-RELEASE-NOTES.md",
    "release/RC-1-VALIDATION.md",
    "release/evidence/records/manual-deployment-rc.1.json",
    "release/evidence/records/rc.1-promotion.json",
    "release/rc.1.manifest.json"
  ],
  "files_replaced": [
    "CLAUDE-DIRECTORY/registry.json` \u2192 `.claude/registry.json",
    "CLAUDE-DIRECTORY/runtime.yaml` \u2192 `.claude/runtime.yaml",
    "CHANGELOG.md",
    "README.md",
    "VERSION",
    "adapters/claude/runtime-declaration.json",
    "adapters/codex/generated/agent-map.json",
    "adapters/codex/generated/catalog-manifest.json",
    "adapters/codex/generated/command-map.json",
    "adapters/codex/generated/review-map.json",
    "adapters/codex/generated/skill-map.json",
    "adapters/codex/generated/workflow-map.json",
    "adapters/codex/runtime-declaration.json",
    "adapters/codex/runtime-manifest.json",
    "adapters/codex/runtime-map.yaml",
    "adapters/shared/runtime-contract.json",
    "adapters/shared/source-of-truth-manifest.json",
    "adapters/shared/task-routing-policy.json",
    "compatibility/core-contracts.json",
    "compatibility/deprecations.json",
    "compatibility/semantic-version-matrix.md",
    "compatibility/support-policy.md",
    "release/KNOWN-LIMITATIONS.md",
    "release/RC-RELEASE-CHECKLIST.md",
    "release/evidence/audit-bundle.json",
    "release/manifest.json",
    "release/version-sources.json",
    "schemas/core-contracts.schema.json",
    "templates/contradiction-register.json",
    "templates/evidence-record.json",
    "templates/project-brief.json",
    "templates/reconciliation-proposal.json",
    "templates/resume-packet.json",
    "templates/session-brief.json",
    "tests/contract/test_beta_release.py",
    "tests/contract/test_core_contracts.py",
    "tests/contract/test_version_management.py"
  ],
  "files_deleted": [],
  "validation": [
    "Manual preflight accepted the exact 0.1.0-beta.12 base.",
    "Simulation applied 6 additions, 37 replacements, and 0 deletions to a copy of the merged base.",
    "Resulting VERSION is 0.1.0-rc.1.",
    "Canonical .claude/ paths and unrelated base files were preserved.",
    "All package payload paths and hashes matched the patch manifest."
  ],
  "operator_notes": [
    "Simulation used merge commit 6f8d82dc3241a923ea0ee0f81e1e02e50b45c521 as the immutable base.",
    "CLAUDE-DIRECTORY/ payload paths map to .claude/ in the installed repository.",
    "The RC migration declares no file deletions."
  ],
  "status": "simulated"
}
